"pathway","pvalue","NES","genes"
"HALLMARK_APICAL_JUNCTION",0.000196309383588536,1.88105661948848,"CDH6, ACTG2, TNFRSF11B, NEXN, PCDH1, ICAM5, VASP, ARPC2, MYL12B, ACTN4, MYL9, CAP1, CALB2, MYH9, AMIGO2, TAOK2, ACTB, PARD6G, ITGA3, PIK3CB, CD274, YWHAH, ACTN1, DSC3, STX4, CTNND1, CNN2, INPPL1, SHROOM2, CNTN1, ADRA1B, ZYX, ACTG1, RSU1, DLG1, MPP5, PFN1, SLC30A3, VCL, PTK2, SORBS3, CDH8, NF2, AKT3, BAIAP2, PARVA, PIK3R3, MVD, GNAI2, CDH15, NF1, ADAM23, MAPK11, CDH4, MSN, AMH, CDK8, IKBKG, SHC1, THY1, FSCN1, JUP, ICAM1, CDH3, ITGA2, TSPAN4, GAMT, ICAM4, ITGB1, PLCG1, CLDN14"
"HALLMARK_MYOGENESIS",0.000196309383588536,1.8107112329078,"TAGLN, CACNA1H, GJA5, KIFC3, PSEN2, IGFBP7, DMD, CDH13, MYO1C, MYLK, MYH9, RB1, COL4A2, AGRN, HBEGF, PDLIM7, CHRNA1, RIT1, HSPB8, CNN3, MYH8, MEF2A, MAPRE3, SYNGR2, MYH4, KLF5, SPTAN1, MYH1, CASQ2, ENO3, NOS1, SIRT2, FKBP1B, ITGA7, REEP1, SMTN, MYH11, IFRD1, SORBS3, SORBS1, LPIN1, PLXNB2, MAPK12, ACHE, PICK1, COX7A1, FLII, TPM3, DMPK, AEBP1, LDB3, IGFBP3, CHRNB1, NCAM1, FDPS, SCHIP1, ABLIM1"
"HALLMARK_HEDGEHOG_SIGNALING",0.0141321656050955,1.60877930490697,"CELSR1, RTN1, MYH9, NRP2, CDK5R1, AMOT, HEY2, NKX6-1, ACHE, CDK6, CRMP1, NF1, OPHN1, THY1"
"HALLMARK_PI3K_AKT_MTOR_SIGNALING",0.00314095013741657,1.59820213754585,"DUSP3, CAMK4, RIPK1, ACTR3, RIT1, ACTR2, SLC2A1, MKNK1, ARHGDIA, E2F1, PRKAA2, GNA14, PFN1, RAF1, ARPC3, SQSTM1, PPP2R1B, UBE2N, CFL1, PIK3R3, GSK3B, PPP1CA, CLTC, RALB, GRB2, MAPK8, YWHAB, RPTOR, MYD88, PIN1, AKT1, EIF4E, MAPK9, NGF, PLCG1, MAP2K3, ADCY2, ARF1, HRAS, PTPN11, UBE2D3, MAP3K7, TBK1, PLCB1"
"HALLMARK_APOPTOSIS",0.002940599882376,1.55399172853364,"DAP, PSEN2, PPP2R5B, CCND1, TGFB2, H1F0, NEDD9, BCL2L1, CFLAR, RHOT2, PEA15, TNFRSF12A, GADD45A, HSPB1, BIRC3, MCL1, SPTAN1, EBP, RELA, KRT18, BCL2L2, LEF1, CASP3, CYLD, RETSAT, TXNIP, DNAJA1, BCL10, PTK2, ENO2, ERBB2, TSPO, SQSTM1, SLC20A1, PMAIP1, VDAC2, TIMP3, IGF2R, ANXA1, PSEN1, ROCK1, RHOB, DIABLO"
"HALLMARK_ANDROGEN_RESPONSE",0.0149253731343284,1.47242097804821,"MYL12A, FADS1, PDLIM5, CCND1, CCND3, H1F0, SRP19, DHCR24, ACTN1, MAP7, ADRM1, SRF, STK39, PTPN21, IDI1, KRT19, SLC26A2, DBI, CDK6, HMGCR"
"HALLMARK_CHOLESTEROL_HOMEOSTASIS",0.0254237288135593,1.45270002804364,"DHCR7, FADS2, STARD4, ETHE1, TNFRSF12A, SREBF2, JAG1, EBP, ACTG1, ATXN2, PCYT2, CYP51A1, LDLR, ABCA2, ERRFI1, IDI1, MVD, HMGCR, ACAT2, FDPS, ANTXR2, TM7SF2, PLAUR, SQLE, NSDHL, FDFT1, PMVK"
"HALLMARK_EPITHELIAL_MESENCHYMAL_TRANSITION",0.00682660425199922,1.43214384436291,"ACTA2, EDIL3, CDH6, TAGLN, TNFRSF11B, VEGFC, RGS4, PVR, FSTL3, TNFAIP3, MYL9, CADM1, CAP2, MYLK, FLNA, POSTN, COL4A2, TPM1, CDH2, TNFRSF12A, GADD45A, CYR61, COL4A1, TPM4, GLIPR1, IGFBP2, CTGF, QSOX1, INHBA, GPC1, GEM, NT5E, CALD1, DKK1, THBS1, IL15, ENO2, SPOCK1, AREG, FERMT2, OXTR, TIMP3, ITGA5, FUCA1, PFN2, CD59, IGFBP3, GREM1, SERPINE1"
"HALLMARK_TNFA_SIGNALING_VIA_NFKB",0.0279774625995726,1.31935705827295,"PTGER4, KLF2, IER2, PDLIM5, IL7R, TNFAIP3, CCND1, EDN1, PHLDA2, GPR183, PPP1R15A, SPSB1, CFLAR, HBEGF, GADD45A, CYR61, BIRC3, MCL1, JAG1, RELA, INHBA, RNF19B, GEM, YRDC, DDX58, EHD1, LDLR, AREG, SQSTM1, SERPINB2, LITAF, MXD1, TUBB2A, BCL2A1, CLCF1, FUT4, LIF, SERPINE1, FOSB, DRAM1, RHOB, NFAT5, ICAM1, SGK1, PLAUR, SERPINB8, PTX3, IL1B, BIRC2, DUSP5, MAP2K3, IER5, TNFRSF9, JUN, TAP1, DUSP1, NFKB2, SLC16A6, FOSL1, NFKB1, CCL20, MAFF, IFNGR2, NFKBIE, TNIP1, IFIT2"
"HALLMARK_XENOBIOTIC_METABOLISM",0.0259130789634768,-1.33826822480297,"PROS1, RAP1GAP, AKR1C3, IL1R1, HMOX1, IGF1, SLC1A5, MAN1A1, ATOH8, F10, PTGDS, HGFAC, RBP4, KYNU, ACOX2, HSD17B2, FBLN1, PTGES, APOE, IGFBP4, EPHX1, AKR1C2, ALAS1, FAS, CDA, PGRMC1, PEMT, ALDH2, PDK4, TNFRSF1A, SHMT2, DHPS, ABCC3, TPST1, NFS1, CFB, ARG2, CDO1, ABCC2, BPHL"
"HALLMARK_HYPOXIA",0.0104529616724739,-1.39507279413478,"PGF, WISP2, GPC3, GPC4, FOSL2, EGFR, HMOX1, TGFB3, FOXO3, CA12, DDIT4, NFIL3, PNRC1, CDKN1C, PLIN2, PPARGC1A, ADM, HAS1, RORA, ZNF292, PDK1, VHL, MXI1, CCNG2, RBPJ, DCN, KDM3A, SAP30, LOX, NDRG1, FAM162A, SRPX, SELENBP1, PIM1, SLC2A5, CAV1, TGFBI, GCK, PYGM, CDKN1B, TGM2, KLHL24, HDLBP, ADORA2B, HSPA5, EFNA3, ATP7A, ANKZF1, HOXB9, VEGFA, GALK1"
"HALLMARK_DNA_REPAIR",0.00286591606960082,-1.54051710582063,"SNAPC4, REV3L, DCTN4, TAF12, RRM2B, POLR2F, AAAS, SRSF6, PDE4B, TAF10, GTF2H3, RNMT, DUT, ADA, MRPL40, BOLA2, SMAD5, CDA, DDB1, IMPDH2, GPX4, AK1, LIG1, TAF9, POLR2K, SSRP1, RPA3, ERCC8, HPRT1, CMPK2, NPR2, GTF3C5, TARBP2, TYMS, SDCBP, ARL6IP1, NUDT9, GTF2F1, POLR2A, AK3, RFC3, POLR2J, RFC5, EIF1B, ZWINT, POLA1"
"HALLMARK_COAGULATION",0.000814829904257486,-1.68708849865646,"PROS1, ISCU, F8, MMP9, CFD, C3, CLU, PF4, PREP, C1R, F10, C1S, SERPING1, MMP10, ITGB3, GDA, ACOX2, APOC1, FBN1, PROZ, COMP, THBD, HTRA1, PECAM1, MMP2, CAPN5, FYN, A2M, CFB, CTSO, C2, LRP1, PLAU, LAMP2, DPP4"
"HALLMARK_INTERFERON_ALPHA_RESPONSE",0.0012242399510304,-1.72239836360817,"TRIM25, CD74, EPSTI1, OAS1, IFI44L, PROCR, TMEM140, IRF2, UBE2L6, IL7, CASP1, CSF1, CASP8, C1S, PARP9, IFI35, IFITM1, PLSCR1, LY6E, IFI30, LPAR6, LAMP3, USP18"
"HALLMARK_MYC_TARGETS_V2",0.00142798857609139,-1.77029022822831,"CBX3, MYC, SORD, TCOF1, MCM4, DDX18, EXOSC5, NPM1, AIMP2, PLK1, IPO4, GNL3, NOLC1, LAS1L, HSPD1, RCL1, UTP20, PES1, SLC19A1, PPAN, NOP56, CDK4, HSPE1, MPHOSPH10, NOC4L, DUSP2, MRTO4, TMEM97, SUPV3L1, PLK4, RRP9, PHB, IMP4, PRMT3, NOP16, HK2, WDR43, PUS1, RABEPK, PA2G4"
"HALLMARK_IL6_JAK_STAT3_SIGNALING",0.00101276078590237,-1.7841655943202,"CXCL1, PLA2G2A, IL1R1, HMOX1, TNFRSF1B, PF4, ACVRL1, IL7, CSF1, PTPN2, ITGB3, FAS, IL18R1, IL10RB, OSMR, HAX1, TNFRSF1A, PIM1, INHBE, MAP3K8, ACVR1B, A2M, SOCS3, CXCL3, STAT3"
"HALLMARK_G2M_CHECKPOINT",0.000205212394828648,-1.9834501805928,"ABL1, BCL3, NASP, HMMR, FANCC, HMGN2, FOXN3, MYC, TOP2A, CCNT1, CDC7, STAG1, CDC25B, SMC1A, SFPQ, RAD21, CDKN3, ATF5, TLE3, SMARCC1, HNRNPU, BIRC5, SAP30, CCNA2, SMC2, NUMA1, TROAP, EWSR1, CCNB2, TTK, CHEK1, CENPF, ODF2, NEK2, LMNB1, NDC80, KIF20B, PRMT5, CTCF, SMC4, HIF1A, NCL, KIF11, KIF2C, PTTG1, XPO1, CENPE, CDKN1B, CKS2, SS18, CENPA, PLK1, KIF22, BUB1, MAD2L1, TPX2, NUSAP1, H2AFZ, PRC1, NOTCH2, MCM2, POLQ, KIF4A, RACGAP1, NOLC1, KPNA2, HMGB3, ARID4A, TACC3, H2AFV, SLC7A1, TRAIP, AURKA, PBK, RBL1, CUL4A, TOP1, CDC20, PDS5B, SYNCRIP, INCENP, CDK1, EXO1, UPF1, NUP98, PML, CUL1, MKI67, ESPL1, CKS1B, TMPO, TFDP1, CDKN2C, BRCA2, SUV39H1, RPS6KA5, CHAF1A, CDK4, UBE2C, CASP8AP2, MTF2"
"HALLMARK_MYC_TARGETS_V1",0.000205380981721093,-2.18183460866784,"RPS6, RPL6, RPS3, RPS5, RPL18, RPS10, RPL34, RPL22, RPLP0, PABPC1, RPL14, PHB2, POLD2, HNRNPA1, EEF1B2, CBX3, RPS2, PABPC4, APEX1, SF3B3, FBL, HNRNPA2B1, DUT, MYC, HDDC2, XPOT, NHP2, ORC2, SMARCC1, HNRNPU, CCNA2, RUVBL2, MCM4, IMPDH2, DDX18, ERH, RSL1D1, AP3S1, HNRNPR, NPM1, CLNS1A, AIMP2, XPO1, PRDX3, IARS, HNRNPC, MAD2L1, SF3A1, HPRT1, YWHAQ, H2AFZ, TRIM28, TUFM, GNL3, MCM2, LSM2, EPRS, PRPF31, TYMS, SNRPG, UBE2E1, MRPS18B, SNRPD2, NOLC1, RANBP1, KPNA2, SNRPA, HSPD1, CDC20, HNRNPA3, PRDX4, SYNCRIP, PTGES3, PCBP1, RRM1, TARDBP, C1QBP, EIF1AX, CUL1, HDGF, SERBP1, DHX15, UBA2, EIF3D, TFDP1, MCM7, GLO1, COPS5, KARS, XRCC6, DEK, NOP56, CDK4, HSPE1, SNRPD3, ILF2, SRSF7, PSMA2, RAN, CYC1, SNRPD1, EIF3B, CAD, SET, SRSF1, TCP1"
"HALLMARK_E2F_TARGETS",0.000204373594931535,-2.4754217988501,"PAICS, PMS2, POLD2, PRPS1, NCAPD2, BRCA1, NASP, BRMS1L, HMMR, MLH1, DUT, MYC, DEPDC1, TOP2A, PAN2, STAG1, CDC25B, SMC1A, RAD21, CDKN3, ORC2, TIMELESS, BIRC5, TK1, CCNB2, RFC1, CHEK1, MCM4, DLGAP5, LMNB1, NBN, CTCF, SMC4, BUB1B, LIG1, NAA38, PSIP1, CSE1L, KIF2C, PTTG1, XPO1, CENPE, SPAG5, CDKN1B, CKS2, SSRP1, RPA3, TRIP13, PLK1, KIF22, MAD2L1, HMGB2, CDCA3, ASF1A, H2AFZ, MCM2, KIF4A, PRKDC, ANP32E, RACGAP1, RAD50, GINS4, NOLC1, RNASEH2A, DSCC1, RANBP1, KPNA2, HMGB3, NUP107, MXD3, TACC3, CIT, CHEK2, MTHFD2, IPO7, MELK, AURKA, RPA1, GINS3, CDC20, RFC3, PDS5B, PRDX4, SYNCRIP, CDK1, EXOSC8, TIPIN, PPP1R8, RAD51AP1, MKI67, ESPL1, SPC25, CKS1B, CDCA8, TMPO, MCM7, CDKN2C, BRCA2, SUV39H1, XRCC6, DEK, NOP56, SPC24, CDK4, DCK, POLD3, TP53, CENPM, ING3, EED, SMC3, RAN, UBE2S"
